chunk_id,source_document,source_path,department,doc_type,chunk_sequence,token_count,accessible_roles,content
CHUNK-000001,engineering_master_doc.md,D:\Projects\RBAC\data\engineering\engineering_master_doc.md,engineering,md,1,47,"engineering,tech_lead,security,admin","finsolve technologies engineering document  1. introduction  1.1 company overview finsolve technologies is a leading fintech company headquartered in bangalore, india, with operations across north america, europe, and asia-pacific. founded in 2018, finsolve provides innovative financial solutions, including digital banking, payment processing, wealth management, and enterprise financial analytics,"
CHUNK-000002,engineering_master_doc.md,D:\Projects\RBAC\data\engineering\engineering_master_doc.md,engineering,md,2,51,"engineering,tech_lead,security,admin","th management, and enterprise financial analytics, serving over 2 million individual users and 10,000 businesses globally.  1.2 purpose this engineering document outlines the technical architecture, development processes, and operational guidelines for finsolves product ecosystem. it serves as a comprehensive guide for engineering teams, stakeholders, and partners to ensure alignment with finsolve"
CHUNK-000003,engineering_master_doc.md,D:\Projects\RBAC\data\engineering\engineering_master_doc.md,engineering,md,3,49,"engineering,tech_lead,security,admin","rs, and partners to ensure alignment with finsolves mission: to empower financial freedom through secure, scalable, and innovative technology solutions.  1.3 scope this document covers:  system architecture and infrastructure  software development lifecycle (sdlc)  technology stack  security and compliance frameworks  testing and quality assurance methodologies  deployment and devops practices  mo"
CHUNK-000004,engineering_master_doc.md,D:\Projects\RBAC\data\engineering\engineering_master_doc.md,engineering,md,4,43,"engineering,tech_lead,security,admin",methodologies  deployment and devops practices  monitoring and maintenance protocols  future technology roadmap  1.4 document control  version  date  author  changes  --------------------------------  1.0  2025-05-01  engineering team  initial version   1.1  2025-05-14  tech architecture council  updated diagrams and monitoring section   2. system architecture  2.1 overview finsolves architecture 
CHUNK-000005,engineering_master_doc.md,D:\Projects\RBAC\data\engineering\engineering_master_doc.md,engineering,md,5,48,"engineering,tech_lead,security,admin","architecture  2.1 overview finsolves architecture is a microservices-based, cloud-native system designed for scalability, resilience, and security. it leverages a modular design to support rapid feature development and seamless integration with third-party financial systems (e.g., payment gateways, credit bureaus, regulatory reporting systems).  2.2 high-level architecture  client apps  mobile app"
CHUNK-000006,engineering_master_doc.md,D:\Projects\RBAC\data\engineering\engineering_master_doc.md,engineering,md,6,49,"engineering,tech_lead,security,admin","2 high-level architecture  client apps  mobile apps (ios, android)  web app (react)  apis (rest, graphql) api gateway  aws api gateway (routing, authentication, rate limiting) microservices layer  authentication service (oauth 2.0, jwt)  payment processing service  wealth management service  analytics service  notification service data layer  postgresql (transactional data)  mongodb (user profiles"
CHUNK-000007,engineering_master_doc.md,D:\Projects\RBAC\data\engineering\engineering_master_doc.md,engineering,md,7,49,"engineering,tech_lead,security,admin","resql (transactional data)  mongodb (user profiles, metadata)  redis (caching, session management)  amazon s3 (documents, backups) infrastructure  aws (ec2, ecs, lambda)  kubernetes (orchestration)  cloudflare (cdn, ddos protection)   2.3 key components  2.3.1 client applications  mobile apps: native mobile applications developed using swift (ios) and kotlin (android), providing a seamless user ex"
CHUNK-000008,engineering_master_doc.md,D:\Projects\RBAC\data\engineering\engineering_master_doc.md,engineering,md,8,52,"engineering,tech_lead,security,admin","and kotlin (android), providing a seamless user experience with biometric authentication, push notifications, and offline capabilities.  web application: a responsive single page application (spa) built with react, redux, and tailwind css, optimized for various screen sizes and compliant with wcag 2.1 accessibility standards.  api interfaces: restful and graphql apis enabling third-party integrati"
CHUNK-000009,engineering_master_doc.md,D:\Projects\RBAC\data\engineering\engineering_master_doc.md,engineering,md,9,51,"engineering,tech_lead,security,admin","ul and graphql apis enabling third-party integrations, partner systems, and future expansions.  2.3.2 api gateway  centralized entry point for all client requests  implements authentication, authorization, and rate limiting  provides api versioning and documentation via swaggeropenapi  handles request logging and basic analytics  aws api gateway with custom lambda authorizers for sophisticated per"
CHUNK-000010,engineering_master_doc.md,D:\Projects\RBAC\data\engineering\engineering_master_doc.md,engineering,md,10,45,"engineering,tech_lead,security,admin","th custom lambda authorizers for sophisticated permission models  2.3.3 microservices  authentication service: manages user identity, authentication (oauth 2.0), and authorization using jwt tokens. supports multi-factor authentication and single sign-on (sso).  payment processing service: handles domestic and international payment transactions, recurring payments, and reconciliation with multiple "
CHUNK-000011,engineering_master_doc.md,D:\Projects\RBAC\data\engineering\engineering_master_doc.md,engineering,md,11,47,"engineering,tech_lead,security,admin","urring payments, and reconciliation with multiple payment gateways.  wealth management service: provides portfolio management, investment recommendations, and financial goal tracking.  analytics service: processes user financial data to deliver insights, spending patterns, and budgeting recommendations.  notification service: manages push notifications, emails, and sms alerts based on user prefere"
CHUNK-000012,engineering_master_doc.md,D:\Projects\RBAC\data\engineering\engineering_master_doc.md,engineering,md,12,53,"engineering,tech_lead,security,admin","ions, emails, and sms alerts based on user preferences and system events.  2.3.4 data layer  postgresql: primary relational database for transactional data requiring acid compliance.  mongodb: nosql database storing user profiles, preferences, and semi-structured data.  redis: in-memory data store for caching, session management, and pubsub messaging between services.  amazon s3: object storage fo"
CHUNK-000013,engineering_master_doc.md,D:\Projects\RBAC\data\engineering\engineering_master_doc.md,engineering,md,13,49,"engineering,tech_lead,security,admin","ng between services.  amazon s3: object storage for documents, statements, user uploads, and encrypted backups.  2.3.5 infrastructure  aws: primary cloud provider utilizing ec2, ecs, lambda, rds, s3, cloudfront, and other managed services.  kubernetes: container orchestration platform managing microservices deployment, scaling, and failover.  cloudflare: content delivery network (cdn) and security"
CHUNK-000014,engineering_master_doc.md,D:\Projects\RBAC\data\engineering\engineering_master_doc.md,engineering,md,14,51,"engineering,tech_lead,security,admin","flare: content delivery network (cdn) and security layer providing ddos protection, web application firewall (waf), and edge caching.  2.4 scalability architecture  2.4.1 horizontal scaling  kubernetes horizontal pod autoscaler (hpa) automatically scales services based on cpumemory metrics and custom metrics (e.g., queue length).  auto-scaling groups for ec2 instances in the underlying infrastruct"
CHUNK-000015,engineering_master_doc.md,D:\Projects\RBAC\data\engineering\engineering_master_doc.md,engineering,md,15,50,"engineering,tech_lead,security,admin","ps for ec2 instances in the underlying infrastructure.  microservices designed to be stateless, enabling seamless scaling.  2.4.2 database scalability  postgresql uses range-based sharding for high-volume transactional tables.  read replicas for analytics and reporting workloads.  mongodb sharding for user data distribution across multiple clusters.  database connection pooling via pgbouncer to op"
CHUNK-000016,engineering_master_doc.md,D:\Projects\RBAC\data\engineering\engineering_master_doc.md,engineering,md,16,50,"engineering,tech_lead,security,admin",.  database connection pooling via pgbouncer to optimize connection management.  2.4.3 caching strategy  multi-level caching architecture:  application-level caching with redis  api gateway response caching  cdn caching for static assets  database query result caching  cache invalidation using event-based triggers and time-to-live (ttl) policies.  2.5 resilience and fault tolerance  2.5.1 high ava
CHUNK-000017,engineering_master_doc.md,D:\Projects\RBAC\data\engineering\engineering_master_doc.md,engineering,md,17,47,"engineering,tech_lead,security,admin",2.5 resilience and fault tolerance  2.5.1 high availability  multi-availability zone (az) deployments in aws regions.  active-active configurations for critical services.  database replication with automated failover capabilities.  global load balancing for geographic redundancy.  2.5.2 circuit breakers  implemented using istio service mesh to prevent cascading failures.  configurable thresholds f
CHUNK-000018,engineering_master_doc.md,D:\Projects\RBAC\data\engineering\engineering_master_doc.md,engineering,md,18,53,"engineering,tech_lead,security,admin",ent cascading failures.  configurable thresholds for error rates and latency.  fallback mechanisms for degraded service modes.  2.5.3 disaster recovery  regular backups to amazon s3 with versioning enabled.  cross-region replication for critical data.  recovery time objective (rto) of 4 hours.  recovery point objective (rpo) of 15 minutes.  quarterly disaster recovery drills and documentation.  2.
CHUNK-000019,engineering_master_doc.md,D:\Projects\RBAC\data\engineering\engineering_master_doc.md,engineering,md,19,45,"engineering,tech_lead,security,admin",ly disaster recovery drills and documentation.  2.5.4 data consistency  event sourcing patterns for critical financial transactions.  saga pattern for distributed transactions across microservices.  eventual consistency with compensation transactions where appropriate.  3. technology stack  3.1 comprehensive technology matrix  layer  primary technologies  supporting technologies  testing tools  --
CHUNK-000020,engineering_master_doc.md,D:\Projects\RBAC\data\engineering\engineering_master_doc.md,engineering,md,20,45,"engineering,tech_lead,security,admin","logies  supporting technologies  testing tools  --------------------------------------------------------------------  frontend  react 18, redux toolkit, tailwind css  typescript, react query, d3.js  jest, react testing library, cypress   mobile  swift 5.5 (ios), kotlin 1.6 (android)  swiftui, jetpack compose  xctest, espresso, appium   backend  node.js 18 lts, python 3.11 (fastapi), go 1.19  expre"
CHUNK-000021,engineering_master_doc.md,D:\Projects\RBAC\data\engineering\engineering_master_doc.md,engineering,md,21,50,"engineering,tech_lead,security,admin","e.js 18 lts, python 3.11 (fastapi), go 1.19  express.js, pydantic, gin  jest, pytest, go test   apis  rest, graphql, grpc  openapi, apollo server, protocol buffers  postman, graphql playground   database  postgresql 15, mongodb 6.0, redis 7.0  timescaledb, mongoose, jedis  testcontainers, mongodb memory server   infrastructure  aws, kubernetes 1.25  terraform, helm, kustomize  inspec, terratest   "
CHUNK-000022,engineering_master_doc.md,D:\Projects\RBAC\data\engineering\engineering_master_doc.md,engineering,md,22,48,"engineering,tech_lead,security,admin","  terraform, helm, kustomize  inspec, terratest   cicd  jenkins, github actions, argocd  sonarqube, nexus, harbor  junit, pytest   monitoring  prometheus, grafana, elk stack  jaeger, kiali, fluentd  synthetic monitoring, chaos monkey   security  oauth 2.0, jwt, aws waf, cloudflare  vault, certmanager, opa  owasp zap, snyk   3.2 technology selection criteria  performance: technologies that deliver "
CHUNK-000023,engineering_master_doc.md,D:\Projects\RBAC\data\engineering\engineering_master_doc.md,engineering,md,23,49,"engineering,tech_lead,security,admin", criteria  performance: technologies that deliver sub-200ms response times for critical paths.  scalability: ability to handle projected growth (10x in 3 years).  maturity: preference for well-established technologies with active communities.  security: strong security models and regular security updates.  developer experience: tools that enhance productivity and reduce bugs.  cost efficiency: bal
CHUNK-000024,engineering_master_doc.md,D:\Projects\RBAC\data\engineering\engineering_master_doc.md,engineering,md,24,48,"engineering,tech_lead,security,admin","roductivity and reduce bugs.  cost efficiency: balance between performance and operational costs.  3.3 version control and management  all dependencies are locked to specific versions.  dependency upgrade schedule: security patches (immediate), minor versions (monthly), major versions (quarterly).  automated vulnerability scanning of dependencies using snyk and dependabot.  4. software development"
CHUNK-000025,engineering_master_doc.md,D:\Projects\RBAC\data\engineering\engineering_master_doc.md,engineering,md,25,55,"engineering,tech_lead,security,admin",sing snyk and dependabot.  4. software development lifecycle (sdlc)  4.1 agile methodology finsolve follows a scrum-based agile process with 2-week sprints:  4.1.1 scrum ceremonies  sprint planning: product owners and engineering leads define sprint goals and prioritize tasks (4 hours).  daily standups: 15-minute meetings to track progress and address blockers.  sprint review: demo of completed fe
CHUNK-000026,engineering_master_doc.md,D:\Projects\RBAC\data\engineering\engineering_master_doc.md,engineering,md,26,50,"engineering,tech_lead,security,admin","ess blockers.  sprint review: demo of completed features to stakeholders (2 hours).  sprint retrospective: team discusses improvements for the next sprint (1.5 hours).  4.1.2 roles and responsibilities  product owner: maintains product backlog, sets priorities, accepts stories.  scrum master: facilitates ceremonies, removes impediments, coaches team.  development team: self-organizes to deliver sp"
CHUNK-000027,engineering_master_doc.md,D:\Projects\RBAC\data\engineering\engineering_master_doc.md,engineering,md,27,50,"engineering,tech_lead,security,admin","m.  development team: self-organizes to deliver sprint commitments.  technical lead: ensures technical excellence and architectural consistency.  4.2 development workflow  4.2.1 requirements engineering  product managers create user stories in jira following the format: as a user role, i want feature so that benefit.  acceptance criteria defined using gherkin syntax (given-when-then).  engineering"
CHUNK-000028,engineering_master_doc.md,D:\Projects\RBAC\data\engineering\engineering_master_doc.md,engineering,md,28,49,"engineering,tech_lead,security,admin",ing gherkin syntax (given-when-then).  engineering leads validate technical feasibility and estimate complexity using story points (fibonacci sequence).  definition of ready (dor) checklist ensures stories are fully specified before development.  4.2.2 design phase  architects create technical designs using uml diagrams and c4 model documentation.  api specifications defined using openapiswagger w
CHUNK-000029,engineering_master_doc.md,D:\Projects\RBAC\data\engineering\engineering_master_doc.md,engineering,md,29,47,"engineering,tech_lead,security,admin", api specifications defined using openapiswagger with clear requestresponse examples.  uiux designs created in figma with component-based architecture.  design reviews conducted with senior engineers and stakeholders.  4.2.3 coding standards  language-specific style guides enforced via linters:  javascripttypescript: eslint with airbnb configuration  python: black formatter and flake8  go: gofmt a
CHUNK-000030,engineering_master_doc.md,D:\Projects\RBAC\data\engineering\engineering_master_doc.md,engineering,md,30,56,"engineering,tech_lead,security,admin",n  python: black formatter and flake8  go: gofmt and golint  sql: pgformatter  documentation requirements:  public apis must have complete documentation  complex algorithms require explanatory comments  readme.md files for all microservices  4.2.4 code review process  pull requests require at least two approvals:  one from a peer engineer  one from a senior engineer or technical lead  automated ch
CHUNK-000031,engineering_master_doc.md,D:\Projects\RBAC\data\engineering\engineering_master_doc.md,engineering,md,31,53,"engineering,tech_lead,security,admin", a senior engineer or technical lead  automated checks must pass before code review:  linting and style validation  unit test coverage (minimum 85)  no security vulnerabilities (via snyk)  review guidelines focus on:  correctness  performance  security  maintainability  test coverage  4.2.5 testing process  automated tests run in the following sequence:  unit tests  integration tests  end-to-end t
CHUNK-000032,engineering_master_doc.md,D:\Projects\RBAC\data\engineering\engineering_master_doc.md,engineering,md,32,48,"engineering,tech_lead,security,admin",ence:  unit tests  integration tests  end-to-end tests  performance tests  test environments:  development (automated deployment of feature branches)  staging (production-like for qa testing)  pre-production (exact replica of production)  4.2.6 deployment pipeline  continuous integration via jenkins or github actions:  build and package  run tests  static code analysis  security scanning  continuo
CHUNK-000033,engineering_master_doc.md,D:\Projects\RBAC\data\engineering\engineering_master_doc.md,engineering,md,33,49,"engineering,tech_lead,security,admin", static code analysis  security scanning  continuous deployment to development and staging environments  production releases:  scheduled bi-weekly  require manual approval  use blue-green or canary deployment strategies  4.3 version control strategy  4.3.1 git workflow  tool: git (hosted on github enterprise)  branch strategy: gitflow  main: production-ready code  develop: integration branch for f
CHUNK-000034,engineering_master_doc.md,D:\Projects\RBAC\data\engineering\engineering_master_doc.md,engineering,md,34,49,"engineering,tech_lead,security,admin",tion-ready code  develop: integration branch for features  feature: new features and non-emergency fixes  release: release preparation  hotfix: emergency production fixes  4.3.2 commit guidelines  semantic commit messages:  feat: new features  fix: bug fixes  docs: documentation changes  style: code formatting  refactor: code restructuring  perf: performance improvements  test: test additions or c
CHUNK-000035,engineering_master_doc.md,D:\Projects\RBAC\data\engineering\engineering_master_doc.md,engineering,md,35,44,"engineering,tech_lead,security,admin","erformance improvements  test: test additions or corrections  chore: maintenance tasks  conventional commits linked to jira tickets (e.g., feat(auth-123): add biometric authentication)  4.3.3 release management  semantic versioning (major.minor.patch)  automated changelog generation from commit messages  release notes published to internal documentation portal  post-release monitoring period with "
CHUNK-000036,engineering_master_doc.md,D:\Projects\RBAC\data\engineering\engineering_master_doc.md,engineering,md,36,47,"engineering,tech_lead,security,admin","ation portal  post-release monitoring period with on-call support  5. security and compliance  5.1 security architecture  5.1.1 authentication and authorization  user authentication:  oauth 2.0 implementation with jwt tokens  multi-factor authentication (mfa) via sms, email, or authenticator apps  biometric authentication for mobile devices  session management with configurable timeouts  authoriza"
CHUNK-000037,engineering_master_doc.md,D:\Projects\RBAC\data\engineering\engineering_master_doc.md,engineering,md,37,48,"engineering,tech_lead,security,admin",n management with configurable timeouts  authorization:  role-based access control (rbac) for administrative functions  attribute-based access control (abac) for fine-grained permissions  regular permission audits and least-privilege enforcement  5.1.2 data protection  encryption:  data in transit: tls 1.3 for all communications  data at rest: aes-256 encryption using aws kms  field-level encrypti
CHUNK-000038,engineering_master_doc.md,D:\Projects\RBAC\data\engineering\engineering_master_doc.md,engineering,md,38,53,"engineering,tech_lead,security,admin","256 encryption using aws kms  field-level encryption for pii and financial data  database column-level encryption for sensitive fields  data classification:  level 1: public data  level 2: internal use only  level 3: confidential (pii, account data)  level 4: restricted (payment credentials, authentication tokens)  5.1.3 network security  perimeter protection:  aws waf for web application protecti"
CHUNK-000039,engineering_master_doc.md,D:\Projects\RBAC\data\engineering\engineering_master_doc.md,engineering,md,39,52,"engineering,tech_lead,security,admin"," protection:  aws waf for web application protection  cloudflare for ddos mitigation  ip whitelisting for administrative endpoints  network segmentation:  vpc with public, private, and restricted subnets  security groups with least-privilege rules  network acls as a secondary defense layer  api security:  rate limiting to prevent abuse  input validation and sanitization  request signing for partne"
CHUNK-000040,engineering_master_doc.md,D:\Projects\RBAC\data\engineering\engineering_master_doc.md,engineering,md,40,50,"engineering,tech_lead,security,admin","ation and sanitization  request signing for partner apis  5.2 compliance frameworks  5.2.1 regulatory compliance  digital personal data protection act, 2023 (dpdp):  data localization requirements  user consent management  right to access and delete personal data  general data protection regulation (gdpr):  data subject rights  data protection impact assessments  breach notification procedures  pa"
CHUNK-000041,engineering_master_doc.md,D:\Projects\RBAC\data\engineering\engineering_master_doc.md,engineering,md,41,47,"engineering,tech_lead,security,admin",ct assessments  breach notification procedures  payment card industry data security standard (pci-dss):  level 1 compliance for payment processing  regular penetration testing  cardholder data environment isolation  5.2.2 industry standards  iso 27001: information security management system  owasp top 10: protection against common web vulnerabilities  nist cybersecurity framework: security control
CHUNK-000042,engineering_master_doc.md,D:\Projects\RBAC\data\engineering\engineering_master_doc.md,engineering,md,42,48,"engineering,tech_lead,security,admin",es  nist cybersecurity framework: security control implementation  5.2.3 compliance monitoring  quarterly internal audits  annual external audits  automated compliance checks in cicd pipeline  continuous control monitoring via aws config  5.3 security operations  5.3.1 vulnerability management  regular scanning using:  owasp zap for dynamic application security testing  snyk for dependency vulnera
CHUNK-000043,engineering_master_doc.md,D:\Projects\RBAC\data\engineering\engineering_master_doc.md,engineering,md,43,51,"engineering,tech_lead,security,admin",tion security testing  snyk for dependency vulnerabilities  custom scripts for business logic vulnerabilities  severity classification:  critical: immediate remediation (24 hours)  high: remediation within 7 days  medium: remediation within 30 days  low: next planned release  5.3.2 incident response  security operations center (soc):  247 monitoring via splunk  automated alerts based on mitre attc
CHUNK-000044,engineering_master_doc.md,D:\Projects\RBAC\data\engineering\engineering_master_doc.md,engineering,md,44,49,"engineering,tech_lead,security,admin","g via splunk  automated alerts based on mitre attck framework  threat intelligence integration  incident classification:  p0: critical (data breach, service outage)  p1: high (potential breach, significant impact)  p2: medium (limited impact)  p3: low (minimal impact)  response procedure:  identification and containment  evidence collection  remediation and recovery  post-incident analysis and les"
CHUNK-000045,engineering_master_doc.md,D:\Projects\RBAC\data\engineering\engineering_master_doc.md,engineering,md,45,50,"engineering,tech_lead,security,admin","ation and recovery  post-incident analysis and lessons learned  5.3.3 security training  mandatory security awareness training for all employees  role-specific security training for developers, administrators  quarterly phishing simulations  security champions program within engineering teams  6. testing and quality assurance  6.1 testing strategy  6.1.1 test pyramid  unit tests:  cover 90 of code"
CHUNK-000046,engineering_master_doc.md,D:\Projects\RBAC\data\engineering\engineering_master_doc.md,engineering,md,46,52,"engineering,tech_lead,security,admin"," 6.1.1 test pyramid  unit tests:  cover 90 of code base  focus on business logic and edge cases  implemented using jest (node.js), pytest (python), go testing  integration tests:  validate microservice interactions  test database operations and external service integrations  implemented using postmannewman and custom test harnesses  end-to-end tests:  simulate complete user journeys  cover critica"
