chunk_id,source_document,source_path,department,doc_type,chunk_sequence,token_count,accessible_roles,content
CHUNK-000189,hr_data.csv,D:\Projects\RBAC\data\HR\hr_data.csv,hr,csv,21,41,"hr,hr_lead,leadership,admin","anager, sales, shaurya.joshifintechco.com, mumbai, 1995-01-15, 2023-06-15, finemp1000, 1703490.23, 7, 6, 90.84, 1, 2024-07-30 finemp1042, vihaan desai, customer support, operations, vihaan.desaifintechco.com, pune, 1992-12-01, 2024-03-28, finemp1007, 1785167.47, 16, 1, 89.15, 4, 2025-04-28 finemp1043, aadhya singh, sales manager, sales, aadhya.singhfintechco.com, pune, 1984-05-24, 2024-06-02, fine"
CHUNK-000190,hr_data.csv,D:\Projects\RBAC\data\HR\hr_data.csv,hr,csv,22,42,"hr,hr_lead,leadership,admin","hfintechco.com, pune, 1984-05-24, 2024-06-02, finemp1000, 849227.01, 17, 14, 91.97, 4, 2024-02-16 finemp1044, isha desai, software engineer, technology, isha.desaifintechco.com, chennai, 1988-12-22, 2021-12-03, finemp1008, 667541.44, 9, 1, 88.61, 5, 2024-09-13 finemp1045, ananya banerjee, data analyst, data, ananya.banerjeefintechco.com, mumbai, 1996-04-07, 2023-10-29, finemp1000, 911824.83, 14, 4"
CHUNK-000191,hr_data.csv,D:\Projects\RBAC\data\HR\hr_data.csv,hr,csv,23,43,"hr,hr_lead,leadership,admin","96-04-07, 2023-10-29, finemp1000, 911824.83, 14, 4, 99.1, 4, 2025-02-05 finemp1046, shaurya joshi, marketing manager, marketing, shaurya.joshifintechco.com, kolkata, 1987-12-21, 2018-11-03, finemp1008, 865704.81, 19, 17, 94.1, 1, 2024-04-13 finemp1047, ishaan singh, business analyst, business, ishaan.singhfintechco.com, chennai, 1981-11-25, 2018-11-25, finemp1007, 1858162.08, 24, 24, 86.19, 5, 202"
CHUNK-000192,hr_data.csv,D:\Projects\RBAC\data\HR\hr_data.csv,hr,csv,24,45,"hr,hr_lead,leadership,admin","-25, finemp1007, 1858162.08, 24, 24, 86.19, 5, 2025-03-06 finemp1048, isha singh, financial analyst, finance, isha.singhfintechco.com, delhi, 1994-10-22, 2023-03-26, finemp1008, 1386670.96, 14, 7, 98.85, 3, 2024-07-31 finemp1049, arjun garg, product manager, product, arjun.gargfintechco.com, hyderabad, 1977-09-17, 2024-05-08, finemp1005, 1447037.81, 13, 4, 85.89, 5, 2024-02-01 finemp1050, myra gup"
CHUNK-000193,hr_data.csv,D:\Projects\RBAC\data\HR\hr_data.csv,hr,csv,25,45,"hr,hr_lead,leadership,admin",", 13, 4, 85.89, 5, 2024-02-01 finemp1050, myra gupta, qa engineer, quality assurance, myra.guptafintechco.com, lucknow, 1982-10-12, 2021-02-01, finemp1008, 865633.34, 25, 6, 97.9, 1, 2024-05-17 finemp1051, reyansh saxena, security engineer, technology, reyansh.saxenafintechco.com, bengaluru, 1992-10-09, 2023-09-01, finemp1000, 1064443.02, 26, 2, 80.35, 4, 2025-04-15 finemp1052, ishaan singh, relat"
CHUNK-000194,hr_data.csv,D:\Projects\RBAC\data\HR\hr_data.csv,hr,csv,26,44,"hr,hr_lead,leadership,admin",".35, 4, 2025-04-15 finemp1052, ishaan singh, relationship manager, sales, ishaan.singhfintechco.com, kolkata, 1998-05-14, 2018-07-09, finemp1000, 1673343.38, 0, 0, 80.95, 4, 2024-06-08 finemp1053, isha sharma, customer support, operations, isha.sharmafintechco.com, kolkata, 1991-12-07, 2020-11-08, finemp1002, 1502270.01, 7, 7, 91.65, 5, 2024-05-12 finemp1054, ishaan singh, data scientist, data, is"
CHUNK-000195,hr_data.csv,D:\Projects\RBAC\data\HR\hr_data.csv,hr,csv,27,43,"hr,hr_lead,leadership,admin","finemp1054, ishaan singh, data scientist, data, ishaan.singhfintechco.com, delhi, 1975-05-28, 2019-10-12, finemp1004, 1675521.46, 21, 4, 84.17, 1, 2024-06-21 finemp1055, aditya saxena, hr manager, hr, aditya.saxenafintechco.com, ahmedabad, 1981-08-27, 2024-09-30, finemp1009, 745459.27, 11, 2, 91.63, 1, 2024-03-07 finemp1056, saanvi bhat, ux designer, design, saanvi.bhatfintechco.com, delhi, 1980-1"
CHUNK-000196,hr_data.csv,D:\Projects\RBAC\data\HR\hr_data.csv,hr,csv,28,40,"hr,hr_lead,leadership,admin","r, design, saanvi.bhatfintechco.com, delhi, 1980-10-25, 2018-08-15, finemp1004, 685364.51, 2, 1, 99.67, 2, 2024-06-24 finemp1057, aditya kapoor, marketing manager, marketing, aditya.kapoorfintechco.com, lucknow, 1979-10-19, 2022-04-22, finemp1006, 1641119.13, 10, 1, 92.5, 2, 2024-06-07 finemp1058, avni chopra, financial analyst, finance, avni.choprafintechco.com, hyderabad, 1990-07-25, 2019-09-03,"
CHUNK-000197,hr_data.csv,D:\Projects\RBAC\data\HR\hr_data.csv,hr,csv,29,40,"hr,hr_lead,leadership,admin","afintechco.com, hyderabad, 1990-07-25, 2019-09-03, finemp1006, 1098952.83, 8, 3, 96.31, 5, 2025-01-31 finemp1059, saanvi malhotra, customer support, operations, saanvi.malhotrafintechco.com, lucknow, 1995-05-31, 2018-08-30, finemp1006, 1430154.39, 12, 12, 93.02, 2, 2025-04-25 finemp1060, arjun mehta, sales manager, sales, arjun.mehtafintechco.com, bengaluru, 1985-08-27, 2020-11-05, finemp1007, 125"
CHUNK-000198,hr_data.csv,D:\Projects\RBAC\data\HR\hr_data.csv,hr,csv,30,40,"hr,hr_lead,leadership,admin","bengaluru, 1985-08-27, 2020-11-05, finemp1007, 1258070.34, 6, 0, 98.75, 4, 2024-09-21 finemp1061, vivaan chowdhury, blockchain developer, technology, vivaan.chowdhuryfintechco.com, jaipur, 1982-09-21, 2020-03-01, finemp1008, 1349620.28, 9, 0, 81.37, 3, 2024-01-19 finemp1062, ananya iyer, product manager, product, ananya.iyerfintechco.com, chennai, 1982-07-13, 2019-08-23, finemp1007, 1641718.19, 17"
CHUNK-000199,hr_data.csv,D:\Projects\RBAC\data\HR\hr_data.csv,hr,csv,31,44,"hr,hr_lead,leadership,admin","1982-07-13, 2019-08-23, finemp1007, 1641718.19, 17, 7, 96.07, 1, 2025-03-09 finemp1063, aadhya kapoor, risk analyst, risk, aadhya.kapoorfintechco.com, jaipur, 1991-07-10, 2021-10-27, finemp1004, 1833641.2, 8, 1, 85.81, 2, 2024-06-29 finemp1064, saanvi nair, risk analyst, risk, saanvi.nairfintechco.com, lucknow, 1982-09-11, 2021-05-12, finemp1004, 1809813.11, 0, 0, 83.64, 2, 2024-05-17 finemp1065, "
CHUNK-000200,hr_data.csv,D:\Projects\RBAC\data\HR\hr_data.csv,hr,csv,32,45,"hr,hr_lead,leadership,admin","809813.11, 0, 0, 83.64, 2, 2024-05-17 finemp1065, myra garg, blockchain developer, technology, myra.gargfintechco.com, lucknow, 1989-05-09, 2019-03-28, finemp1004, 1947873.28, 6, 2, 81.24, 2, 2024-10-03 finemp1066, diya iyer, sales manager, sales, diya.iyerfintechco.com, jaipur, 1977-05-24, 2020-12-19, finemp1008, 1333935.56, 24, 10, 91.78, 1, 2025-01-09 finemp1067, shaurya chopra, compliance offi"
CHUNK-000201,hr_data.csv,D:\Projects\RBAC\data\HR\hr_data.csv,hr,csv,33,42,"hr,hr_lead,leadership,admin","-01-09 finemp1067, shaurya chopra, compliance officer, compliance, shaurya.choprafintechco.com, lucknow, 1998-03-26, 2021-10-06, finemp1001, 368244.88, 0, 0, 80.02, 3, 2024-05-01 finemp1068, shaurya singh, data scientist, data, shaurya.singhfintechco.com, jaipur, 1979-05-02, 2024-02-23, finemp1002, 1803057.99, 6, 0, 81.1, 3, 2024-11-14 finemp1069, vivaan saxena, risk analyst, risk, vivaan.saxenafi"
CHUNK-000202,hr_data.csv,D:\Projects\RBAC\data\HR\hr_data.csv,hr,csv,34,41,"hr,hr_lead,leadership,admin","vivaan saxena, risk analyst, risk, vivaan.saxenafintechco.com, lucknow, 1996-07-25, 2018-04-21, finemp1003, 1596298.88, 21, 12, 96.61, 4, 2024-09-28 finemp1070, saanvi banerjee, credit officer, finance, saanvi.banerjeefintechco.com, pune, 1978-10-20, 2020-12-24, finemp1000, 1872784.84, 17, 6, 95.36, 2, 2024-02-04 finemp1071, vivaan verma, credit officer, finance, vivaan.vermafintechco.com, bengalu"
CHUNK-000203,hr_data.csv,D:\Projects\RBAC\data\HR\hr_data.csv,hr,csv,35,41,"hr,hr_lead,leadership,admin","ficer, finance, vivaan.vermafintechco.com, bengaluru, 1986-04-27, 2019-03-21, finemp1008, 1643988.07, 0, 0, 98.33, 2, 2024-10-15 finemp1072, saanvi gupta, qa engineer, quality assurance, saanvi.guptafintechco.com, bengaluru, 1998-08-31, 2019-11-08, finemp1003, 1333187.28, 15, 1, 97.66, 3, 2024-07-14 finemp1073, diya nair, relationship manager, sales, diya.nairfintechco.com, delhi, 1988-11-24, 2024"
CHUNK-000204,hr_data.csv,D:\Projects\RBAC\data\HR\hr_data.csv,hr,csv,36,41,"hr,hr_lead,leadership,admin","s, diya.nairfintechco.com, delhi, 1988-11-24, 2024-08-22, finemp1004, 1416536.32, 0, 0, 95.13, 5, 2025-01-29 finemp1074, vihaan chopra, relationship manager, sales, vihaan.choprafintechco.com, mumbai, 1996-03-28, 2024-09-10, finemp1005, 1938308.68, 6, 5, 92.42, 3, 2025-04-12 finemp1075, ananya khan, qa engineer, quality assurance, ananya.khanfintechco.com, mumbai, 1994-03-30, 2019-05-14, finemp100"
CHUNK-000205,hr_data.csv,D:\Projects\RBAC\data\HR\hr_data.csv,hr,csv,37,44,"hr,hr_lead,leadership,admin","hco.com, mumbai, 1994-03-30, 2019-05-14, finemp1009, 687174.91, 6, 4, 87.01, 5, 2025-04-27 finemp1076, avni chowdhury, credit officer, finance, avni.chowdhuryfintechco.com, delhi, 1994-03-28, 2022-01-25, finemp1008, 589221.29, 27, 26, 88.76, 4, 2024-02-25 finemp1077, krishna nair, ux designer, design, krishna.nairfintechco.com, mumbai, 1995-08-16, 2019-12-07, finemp1004, 1477253.1, 8, 5, 97.75, 1,"
CHUNK-000206,hr_data.csv,D:\Projects\RBAC\data\HR\hr_data.csv,hr,csv,38,43,"hr,hr_lead,leadership,admin","2019-12-07, finemp1004, 1477253.1, 8, 5, 97.75, 1, 2024-08-06 finemp1078, prisha chopra, data analyst, data, prisha.choprafintechco.com, lucknow, 1981-03-18, 2023-08-01, finemp1001, 1438958.04, 24, 1, 90.49, 2, 2024-02-28 finemp1079, krishna iyer, financial analyst, finance, krishna.iyerfintechco.com, ahmedabad, 1984-02-29, 2023-10-05, finemp1000, 1507078.74, 20, 11, 87.41, 3, 2024-01-22 finemp108"
CHUNK-000207,hr_data.csv,D:\Projects\RBAC\data\HR\hr_data.csv,hr,csv,39,44,"hr,hr_lead,leadership,admin","1507078.74, 20, 11, 87.41, 3, 2024-01-22 finemp1080, avni reddy, data analyst, data, avni.reddyfintechco.com, pune, 1995-01-29, 2021-02-24, finemp1000, 400948.72, 14, 0, 81.49, 5, 2024-12-08 finemp1081, sakshi malhotra, credit officer, finance, sakshi.malhotrafintechco.com, mumbai, 1997-06-09, 2019-06-09, finemp1004, 1113984.52, 25, 18, 80.71, 3, 2024-07-26 finemp1082, vihaan chowdhury, financial "
CHUNK-000208,hr_data.csv,D:\Projects\RBAC\data\HR\hr_data.csv,hr,csv,40,41,"hr,hr_lead,leadership,admin","024-07-26 finemp1082, vihaan chowdhury, financial analyst, finance, vihaan.chowdhuryfintechco.com, hyderabad, 1998-06-24, 2018-07-22, finemp1005, 1036719.56, 18, 7, 93.4, 2, 2024-01-21 finemp1083, krishna malhotra, sales manager, sales, krishna.malhotrafintechco.com, pune, 1976-08-20, 2022-12-26, finemp1001, 1413177.7, 25, 21, 91.85, 1, 2024-01-21 finemp1084, saanvi chowdhury, business analyst, bu"
CHUNK-000209,hr_data.csv,D:\Projects\RBAC\data\HR\hr_data.csv,hr,csv,41,42,"hr,hr_lead,leadership,admin","finemp1084, saanvi chowdhury, business analyst, business, saanvi.chowdhuryfintechco.com, pune, 1976-03-24, 2023-06-22, finemp1004, 1982774.95, 5, 4, 99.17, 2, 2024-06-10 finemp1085, aadhya mehta, qa engineer, quality assurance, aadhya.mehtafintechco.com, kolkata, 1983-12-03, 2021-10-11, finemp1000, 1026240.03, 6, 6, 92.28, 2, 2024-12-19 finemp1086, diya iyer, data analyst, data, diya.iyerfintechco"
CHUNK-000210,hr_data.csv,D:\Projects\RBAC\data\HR\hr_data.csv,hr,csv,42,42,"hr,hr_lead,leadership,admin"," diya iyer, data analyst, data, diya.iyerfintechco.com, kolkata, 1989-09-24, 2018-11-28, finemp1006, 1950772.9, 2, 2, 88.26, 5, 2024-03-21 finemp1087, avni nair, relationship manager, sales, avni.nairfintechco.com, chennai, 1999-08-05, 2021-10-06, finemp1008, 1333720.85, 19, 3, 90.98, 2, 2024-05-16 finemp1088, avni chowdhury, customer support, operations, avni.chowdhuryfintechco.com, delhi, 1989-0"
CHUNK-000211,hr_data.csv,D:\Projects\RBAC\data\HR\hr_data.csv,hr,csv,43,39,"hr,hr_lead,leadership,admin","ations, avni.chowdhuryfintechco.com, delhi, 1989-05-18, 2020-11-25, finemp1005, 614347.62, 15, 0, 98.8, 5, 2024-04-14 finemp1089, aarav joshi, security engineer, technology, aarav.joshifintechco.com, lucknow, 1977-05-07, 2021-03-01, finemp1003, 330010.27, 4, 4, 82.24, 1, 2024-10-29 finemp1090, arjun chowdhury, software engineer, technology, arjun.chowdhuryfintechco.com, hyderabad, 1993-02-04, 2022"
CHUNK-000212,hr_data.csv,D:\Projects\RBAC\data\HR\hr_data.csv,hr,csv,44,41,"hr,hr_lead,leadership,admin","howdhuryfintechco.com, hyderabad, 1993-02-04, 2022-07-30, finemp1007, 454938.59, 23, 9, 91.15, 1, 2024-09-26 finemp1091, diya desai, compliance officer, compliance, diya.desaifintechco.com, chennai, 1982-05-28, 2022-03-23, finemp1008, 1262938.4, 19, 3, 86.4, 1, 2024-08-30 finemp1092, ananya nair, hr manager, hr, ananya.nairfintechco.com, hyderabad, 1997-11-12, 2019-11-25, finemp1003, 512211.07, 4,"
CHUNK-000213,hr_data.csv,D:\Projects\RBAC\data\HR\hr_data.csv,hr,csv,45,43,"hr,hr_lead,leadership,admin"," 1997-11-12, 2019-11-25, finemp1003, 512211.07, 4, 4, 85.19, 3, 2024-05-18 finemp1093, shaurya sharma, product manager, product, shaurya.sharmafintechco.com, mumbai, 1976-10-18, 2024-07-28, finemp1002, 1325752.2, 12, 9, 93.73, 5, 2024-01-31 finemp1094, aarav kapoor, ux designer, design, aarav.kapoorfintechco.com, lucknow, 1994-12-04, 2023-06-29, finemp1007, 1373465.39, 24, 2, 91.59, 2, 2024-10-23 "
CHUNK-000214,hr_data.csv,D:\Projects\RBAC\data\HR\hr_data.csv,hr,csv,46,45,"hr,hr_lead,leadership,admin","nemp1007, 1373465.39, 24, 2, 91.59, 2, 2024-10-23 finemp1095, ananya khan, qa engineer, quality assurance, ananya.khanfintechco.com, delhi, 1997-04-09, 2021-03-12, finemp1008, 305337.03, 18, 4, 88.06, 5, 2024-02-15 finemp1096, krishna bhat, credit officer, finance, krishna.bhatfintechco.com, delhi, 1983-07-25, 2022-03-25, finemp1003, 807527.48, 8, 6, 97.67, 3, 2024-01-04 finemp1097, sakshi kapoor,"
CHUNK-000215,hr_data.csv,D:\Projects\RBAC\data\HR\hr_data.csv,hr,csv,47,43,"hr,hr_lead,leadership,admin","6, 97.67, 3, 2024-01-04 finemp1097, sakshi kapoor, marketing manager, marketing, sakshi.kapoorfintechco.com, bengaluru, 1995-09-14, 2018-02-10, finemp1000, 1468652.84, 18, 14, 94.91, 2, 2024-05-14 finemp1098, arjun patel, risk analyst, risk, arjun.patelfintechco.com, jaipur, 1994-01-29, 2018-11-26, finemp1004, 1521060.31, 19, 9, 92.26, 4, 2024-08-06 finemp1099, shaurya chowdhury, devops engineer, "
CHUNK-000216,hr_data.csv,D:\Projects\RBAC\data\HR\hr_data.csv,hr,csv,48,18,"hr,hr_lead,leadership,admin","6 finemp1099, shaurya chowdhury, devops engineer, technology, shaurya.chowdhuryfintechco.com, mumbai, 1996-11-20, 2020-07-28, finemp1008, 586137.55, 12, 3, 95.52, 3, 2024-11-09"
CHUNK-000217,marketing_report_2024.md,D:\Projects\RBAC\data\marketing\marketing_report_2024.md,marketing,md,1,52,"marketing,sales,leadership,admin","marketing report for finsolve technologies inc. - 2024 executive summary: ------------------------------------------- 2024 was a pivotal year for the marketing department at finsolve technologies, marked by ambitious campaigns, strategic partnerships, and a focus on increasing customer engagement across digital and physical channels. the departments efforts resulted in a 20 increase in new custome"
CHUNK-000218,marketing_report_2024.md,D:\Projects\RBAC\data\marketing\marketing_report_2024.md,marketing,md,2,52,"marketing,sales,leadership,admin","s efforts resulted in a 20 increase in new customer acquisition, a 15 growth in brand awareness, and enhanced customer loyalty. despite a competitive market environment, finsolve technologiess marketing initiatives proved to be cost-effective, delivering a solid return on investment (roi) and positioning the company for further expansion. year-over-year (yoy) performance: -------------------------"
CHUNK-000219,marketing_report_2024.md,D:\Projects\RBAC\data\marketing\marketing_report_2024.md,marketing,md,3,52,"marketing,sales,leadership,admin","-year (yoy) performance: ------------------------------------------- finsolve technologiess marketing team saw a solid year-over-year (yoy) improvement in key performance metrics: 1. new customer acquisition: a 20 increase in new customers, outpacing the industry average of 10 growth. the increase was primarily driven by targeted digital marketing campaigns and improved brand visibility in new int"
CHUNK-000220,marketing_report_2024.md,D:\Projects\RBAC\data\marketing\marketing_report_2024.md,marketing,md,4,58,"marketing,sales,leadership,admin","campaigns and improved brand visibility in new international markets (asia and europe). 2. brand awareness: brand awareness grew by 15, supported by high-visibility campaigns and strategic pr efforts. 3. customer engagement: engagement rates saw a slight increase of 5, driven by content marketing and social media efforts. however, this metric remains a focus for improvement, particularly through p"
CHUNK-000221,marketing_report_2024.md,D:\Projects\RBAC\data\marketing\marketing_report_2024.md,marketing,md,5,45,"marketing,sales,leadership,admin","ns a focus for improvement, particularly through personalized and ai-driven engagement strategies. campaign analysis: ------------------------------------------- 1. digital campaigns: finsolve technologies launched a series of digital campaigns, focusing on performance marketing, content marketing, and social media engagement. the instantwire global expansion campaign, which highlighted finsolve t"
CHUNK-000222,marketing_report_2024.md,D:\Projects\RBAC\data\marketing\marketing_report_2024.md,marketing,md,6,63,"marketing,sales,leadership,admin","l expansion campaign, which highlighted finsolve technologiess expansion into new markets, was the most successful in terms of conversions and brand awareness, leading to a 25 increase in traffic to the website and a 12 increase in sign-ups. - costs: 5m spent on digital ads, influencer partnerships, and sponsored content. - roi: 3.5x return on investment, with 17.5m in generated revenue directly a"
CHUNK-000223,marketing_report_2024.md,D:\Projects\RBAC\data\marketing\marketing_report_2024.md,marketing,md,7,55,"marketing,sales,leadership,admin","stment, with 17.5m in generated revenue directly attributed to these efforts. 2. event marketing: several high-profile industry events and partnerships, including fintech expos and trade shows, helped solidify finsolve technologiess presence in europe and asia. the finsolve technologies fintech innovation event in berlin was the highlight, leading to over 300 new enterprise leads and strengthening"
CHUNK-000224,marketing_report_2024.md,D:\Projects\RBAC\data\marketing\marketing_report_2024.md,marketing,md,8,61,"marketing,sales,leadership,admin","to over 300 new enterprise leads and strengthening vendor relationships. - costs: 2m for event organization and travel. - roi: estimated 5x roi from new partnerships and contracts. 3. email marketing: email campaigns focused on retention and nurturing existing customers resulted in a 10 increase in customer retention. finsolve technologies sent over 2 million emails to existing customers, with a 2"
CHUNK-000225,marketing_report_2024.md,D:\Projects\RBAC\data\marketing\marketing_report_2024.md,marketing,md,9,57,"marketing,sales,leadership,admin","r 2 million emails to existing customers, with a 25 open rate and a 15 click-through rate. - costs: 200k for email design, segmentation, and automation tools. - roi: 2x return on investment, with substantial increases in customer retention. vendor performance: ------------------------------------------- finsolve technologies relied on several key external vendors in 2024 to support its marketing e"
CHUNK-000226,marketing_report_2024.md,D:\Projects\RBAC\data\marketing\marketing_report_2024.md,marketing,md,10,60,"marketing,sales,leadership,admin","xternal vendors in 2024 to support its marketing efforts. these vendors included digital advertising agencies, pr firms, and event organizers. a detailed review of vendor performance for the year highlights the following: 1. vendor a (abc services): responsible for digital marketing and ad placements. vendor a delivered strong results in terms of ad engagement and conversions but faced issues with"
CHUNK-000227,marketing_report_2024.md,D:\Projects\RBAC\data\marketing\marketing_report_2024.md,marketing,md,11,52,"marketing,sales,leadership,admin","d engagement and conversions but faced issues with timely reporting and budget adherence. we recommend renegotiating terms for better performance tracking. 2. vendor b (xyz marketing solutions): responsible for content creation and influencer partnerships. vendor b performed exceptionally well, with several viral campaigns that significantly boosted brand awareness. future contracts should conside"
CHUNK-000228,marketing_report_2024.md,D:\Projects\RBAC\data\marketing\marketing_report_2024.md,marketing,md,12,50,"marketing,sales,leadership,admin",d brand awareness. future contracts should consider expanding their role in influencer partnerships. customer insights: ------------------------------------------- the marketing departments success in 2024 can largely be attributed to its focus on understanding and engaging key customer segments. key insights include: 1. geographic growth: significant increases in customer acquisition in asia and 
CHUNK-000229,marketing_report_2024.md,D:\Projects\RBAC\data\marketing\marketing_report_2024.md,marketing,md,13,59,"marketing,sales,leadership,admin","ant increases in customer acquisition in asia and europe, with asia showing the largest market potential for growth in the coming years. 2. customer demographics: the majority of new customers in 2024 were young professionals aged 25-35, who showed a strong preference for real-time payments and mobile financial solutions. 3. engagement trends: social media interactions, particularly on platforms l"
CHUNK-000230,marketing_report_2024.md,D:\Projects\RBAC\data\marketing\marketing_report_2024.md,marketing,md,14,51,"marketing,sales,leadership,admin","al media interactions, particularly on platforms like instagram and linkedin, drove the highest levels of engagement. customers responded well to educational content about financial empowerment and fintech innovation. marketing budget breakdown: ------------------------------------------- in 2024, the total marketing budget was 15m, allocated as follows: 1. digital marketing: 7m (47)  focused on p"
CHUNK-000231,marketing_report_2024.md,D:\Projects\RBAC\data\marketing\marketing_report_2024.md,marketing,md,15,57,"marketing,sales,leadership,admin","llows: 1. digital marketing: 7m (47)  focused on paid ads, influencer campaigns, and digital content. 2. event marketing: 3m (20)  sponsorships, event organization, and travel. 3. public relations and brand awareness: 2m (13)  press releases, media engagements, and sponsorships. 4. customer retention: 1m (7)  email marketing, customer loyalty programs, and crm tools. 5. market research and analyti"
CHUNK-000232,marketing_report_2024.md,D:\Projects\RBAC\data\marketing\marketing_report_2024.md,marketing,md,16,57,"marketing,sales,leadership,admin","ams, and crm tools. 5. market research and analytics: 2m (13)  market research, surveys, and customer analytics. key metrics  kpis: ------------------------------------------- 1. customer acquisition cost (cac): 150 per new customer (down from 180 in 2023), reflecting more efficient targeting and optimization of ad spend. 2. return on ad spend (roas): 4.5x for digital campaigns, a significant impr"
CHUNK-000233,marketing_report_2024.md,D:\Projects\RBAC\data\marketing\marketing_report_2024.md,marketing,md,17,62,"marketing,sales,leadership,admin","s): 4.5x for digital campaigns, a significant improvement over the 3x in 2023. 3. customer lifetime value (cltv): 1,200 per customer, driven by both higher conversion rates and improved retention strategies. 4. conversion rate: 5 across all digital platforms, indicating strong ad targeting and messaging resonance. 5. click-through rate (ctr): 2.5 for paid ads, up from 2 in 2023, due to better-targ"
CHUNK-000234,marketing_report_2024.md,D:\Projects\RBAC\data\marketing\marketing_report_2024.md,marketing,md,18,52,"marketing,sales,leadership,admin","or paid ads, up from 2 in 2023, due to better-targeted ads and enhanced content. recommendations for improvement: ------------------------------------------- 1. enhance personalization: implement ai-driven marketing automation to increase customer engagement and reduce cac. personalized offers and content should be central to next years strategy. 2. expand market reach: focus on untapped markets, "
CHUNK-000235,marketing_report_2024.md,D:\Projects\RBAC\data\marketing\marketing_report_2024.md,marketing,md,19,56,"marketing,sales,leadership,admin",". expand market reach: focus on untapped markets, particularly in latin america, where finsolve technologiess services have high growth potential. 3. optimize vendor relationships: improve vendor contract terms and increase the use of performance-based incentives to drive better results from external partners. 4. focus on retention: while new customer acquisition is important, the marketing team s"
CHUNK-000236,marketing_report_2024.md,D:\Projects\RBAC\data\marketing\marketing_report_2024.md,marketing,md,20,45,"marketing,sales,leadership,admin","mer acquisition is important, the marketing team should invest more in retaining existing customers through loyalty programs and personalized communication. appendices: ------------------------------------------- detailed performance charts and marketing analytics reports are included in the appendices, which provide insights into conversion rates, roi analysis, and market segmentation."
CHUNK-000237,marketing_report_2024.md,D:\Projects\RBAC\data\marketing\marketing_report_2024.md,marketing,md,21,5,"marketing,sales,leadership,admin"," roi analysis, and market segmentation."
CHUNK-000238,marketing_report_q1_2024.md,D:\Projects\RBAC\data\marketing\marketing_report_q1_2024.md,marketing,md,1,54,"marketing,sales,leadership,admin","comprehensive marketing report - q1 2024  executive summary q1 2024 marked a foundational quarter for finnova, as we focused on building robust marketing infrastructure to support aggressive expansion and enhance customer acquisition channels. this report details our marketing strategies, performance metrics, and strategic objectives, emphasizing our efforts to expand into europe, launch the insta"
