chunk_id,source_document,source_path,department,doc_type,chunk_sequence,token_count,accessible_roles,content
CHUNK-000093,financial_summary.md,D:\Projects\RBAC\data\Finance\financial_summary.md,finance,md,16,55,"finance,finance_lead,leadership,admin","s for better pricing, especially in high-expense categories like marketing events and software subscriptions. consider consolidating suppliers where possible to leverage better terms. 2. automation in vendor payments: automating the accounts payable process will reduce human errors, speed up payments, and help reduce overdue payments, which will positively impact cash flow. 3. employee cost optimi"
CHUNK-000094,financial_summary.md,D:\Projects\RBAC\data\Finance\financial_summary.md,finance,md,17,51,"finance,finance_lead,leadership,admin","sitively impact cash flow. 3. employee cost optimization: as the headcount grows, consider introducing more flexible benefits packages and using technology to reduce hr administrative costs. 4. cost-cutting in non-core activities: explore opportunities to reduce expenses in non-essential categories, including travel and certain office-related costs. risk analysis and mitigation strategies: -------"
CHUNK-000095,financial_summary.md,D:\Projects\RBAC\data\Finance\financial_summary.md,finance,md,18,49,"finance,finance_lead,leadership,admin",". risk analysis and mitigation strategies: ------------------------------------------- 1. risk: vendor cost inflation  vendor services, particularly marketing and software subscriptions, have shown significant price inflation. to mitigate this, a comprehensive vendor risk management plan should be developed, ensuring that contracts are regularly reviewed, and prices negotiated. 2. risk: cash flow "
CHUNK-000096,financial_summary.md,D:\Projects\RBAC\data\Finance\financial_summary.md,finance,md,19,53,"finance,finance_lead,leadership,admin","viewed, and prices negotiated. 2. risk: cash flow volatility  delays in receivables and vendor payment cycles may lead to short-term cash flow volatility. improved working capital management and streamlining payment processes can significantly reduce this risk. 3. risk: operational scalability  as finsolve technologies scales, maintaining operational efficiency will become more challenging. this c"
CHUNK-000097,financial_summary.md,D:\Projects\RBAC\data\Finance\financial_summary.md,finance,md,20,53,"finance,finance_lead,leadership,admin","al efficiency will become more challenging. this can be mitigated by investing in automation, streamlining workflows, and maintaining a leaner organizational structure. 4. risk: regulatory compliance  as the company expands globally, navigating complex regulatory landscapes in different regions may introduce compliance risks. finsolve technologies must invest in legal and compliance teams to ensur"
CHUNK-000098,financial_summary.md,D:\Projects\RBAC\data\Finance\financial_summary.md,finance,md,21,40,"finance,finance_lead,leadership,admin","must invest in legal and compliance teams to ensure adherence to local laws and regulations. appendices: ------------------------------------------- detailed tables and charts are available in the financial statements section of the main report, showcasing yoy comparisons, expense breakdowns, and key ratios."
CHUNK-000099,quarterly_financial_report.md,D:\Projects\RBAC\data\Finance\quarterly_financial_report.md,finance,md,1,53,"finance,finance_lead,leadership,admin","quarterly financial report - finsolve technologies inc. 2024  executive summary in 2024, finsolve technologies inc. delivered exceptional financial performance, achieving significant year-over-year (yoy) growth across all quarters. with a strategic focus on market expansion, customer acquisition, and operational efficiency, the company saw revenue increase from 2.1 billion in q1 to 2.6 billion in "
CHUNK-000100,quarterly_financial_report.md,D:\Projects\RBAC\data\Finance\quarterly_financial_report.md,finance,md,2,56,"finance,finance_lead,leadership,admin","increase from 2.1 billion in q1 to 2.6 billion in q4, alongside consistent improvements in gross margin, operating income, and net income. this report provides a comprehensive overview of finsolve technologiess financial results, expense breakdowns, cash flow analyses, and risk mitigation strategies for each quarter of 2024, underscoring our commitment to sustainable growth and shareholder value. "
CHUNK-000101,quarterly_financial_report.md,D:\Projects\RBAC\data\Finance\quarterly_financial_report.md,finance,md,3,60,"finance,finance_lead,leadership,admin","ment to sustainable growth and shareholder value. ---  q1 - january to march 2024  quarterly financial overview q1 2024 set a strong foundation for the year, with robust revenue growth and operational efficiency. key financial highlights include: - revenue: 2.1 billion, up 22 yoy, driven by strong customer acquisition and increased transaction volumes. - gross margin: 58, reflecting effective cost"
CHUNK-000102,quarterly_financial_report.md,D:\Projects\RBAC\data\Finance\quarterly_financial_report.md,finance,md,4,56,"finance,finance_lead,leadership,admin","mes. - gross margin: 58, reflecting effective cost management and pricing strategies. - operating income: 500 million, supported by streamlined operations and high-margin product offerings. - net income: 250 million, up 10 yoy, bolstered by revenue growth and operational efficiencies. - marketing spend: 500 million, focused on digital marketing campaigns and brand awareness initiatives to support "
CHUNK-000103,quarterly_financial_report.md,D:\Projects\RBAC\data\Finance\quarterly_financial_report.md,finance,md,5,51,"finance,finance_lead,leadership,admin","paigns and brand awareness initiatives to support european market entry. - vendor costs: 120 million, driven by increased marketing activities and employee training programs.  quarterly expense breakdown expenses were strategically allocated to support growth initiatives: - vendor services: 120 million, with 40 (48 million) allocated to marketing-related activities, including digital advertisement"
CHUNK-000104,quarterly_financial_report.md,D:\Projects\RBAC\data\Finance\quarterly_financial_report.md,finance,md,6,54,"finance,finance_lead,leadership,admin","elated activities, including digital advertisements and corporate events. - employee benefits  hr: 45 million, up 15 yoy due to increased staffing and employee development programs. - software subscriptions: 45 million, up 18 yoy, reflecting expanded reliance on cloud-based platforms for operational scalability. - other operational expenses: 30 million, covering travel, office supplies, and admini"
CHUNK-000105,quarterly_financial_report.md,D:\Projects\RBAC\data\Finance\quarterly_financial_report.md,finance,md,7,56,"finance,finance_lead,leadership,admin","lion, covering travel, office supplies, and administrative costs.  cash flow analysis cash flow performance underscored finsolve technologiess financial health: - cash flow from operations: 300 million, up 10 yoy, driven by strong revenue and efficient working capital management. - cash flow from investing: 50 million, allocated to research and development (rd) and market expansion initiatives. - "
CHUNK-000106,quarterly_financial_report.md,D:\Projects\RBAC\data\Finance\quarterly_financial_report.md,finance,md,8,54,"finance,finance_lead,leadership,admin","elopment (rd) and market expansion initiatives. - cash flow from financing: 20 million, reflecting net inflows for working capital optimization.  risks  mitigation - risk: increased vendor costs due to market conditions. - mitigation: initiated vendor negotiations and implemented cost reduction strategies to optimize procurement. - risk: delays in accounts payable processing. - mitigation: streaml"
CHUNK-000107,quarterly_financial_report.md,D:\Projects\RBAC\data\Finance\quarterly_financial_report.md,finance,md,9,57,"finance,finance_lead,leadership,admin","accounts payable processing. - mitigation: streamlined payment workflows and renegotiated vendor contracts to improve cash flow efficiency. ---  q2 - april to june 2024  quarterly financial overview q2 2024 built on q1s momentum, with accelerated revenue growth and improved profitability. key financial highlights include: - revenue: 2.3 billion, up 25 yoy, fueled by strong performance in existing "
CHUNK-000108,quarterly_financial_report.md,D:\Projects\RBAC\data\Finance\quarterly_financial_report.md,finance,md,10,58,"finance,finance_lead,leadership,admin"," 25 yoy, fueled by strong performance in existing markets and early traction in southeast asia. - gross margin: 60, driven by higher-margin product offerings and operational efficiencies. - operating income: 550 million, reflecting increased revenue and disciplined cost management. - net income: 275 million, up 12 yoy, supported by robust top-line growth. - marketing spend: 550 million, primarily "
CHUNK-000109,quarterly_financial_report.md,D:\Projects\RBAC\data\Finance\quarterly_financial_report.md,finance,md,11,53,"finance,finance_lead,leadership,admin","growth. - marketing spend: 550 million, primarily allocated to digital advertising and influencer partnerships to drive southeast asian expansion. - vendor costs: 125 million, increased due to regional marketing campaigns and influencer-driven initiatives.  quarterly expense breakdown expenses were aligned with strategic growth objectives: - vendor services: 125 million, with 50 (62.5 million) ded"
CHUNK-000110,quarterly_financial_report.md,D:\Projects\RBAC\data\Finance\quarterly_financial_report.md,finance,md,12,53,"finance,finance_lead,leadership,admin"," services: 125 million, with 50 (62.5 million) dedicated to influencer marketing and social media campaigns. - employee benefits  hr: 47 million, reflecting investments in employee development and retention programs. - software subscriptions: 47 million, maintaining high operational tech costs to support scalability. - other operational expenses: 33 million, covering promotional events and regiona"
CHUNK-000111,quarterly_financial_report.md,D:\Projects\RBAC\data\Finance\quarterly_financial_report.md,finance,md,13,59,"finance,finance_lead,leadership,admin","3 million, covering promotional events and regional marketing activities.  cash flow analysis cash flow trends remained positive, supporting growth initiatives: - cash flow from operations: 350 million, up 12 yoy, driven by increased revenue and efficient collections. - cash flow from investing: 60 million, allocated to market entry efforts and product development. - cash flow from financing: 25 m"
CHUNK-000112,quarterly_financial_report.md,D:\Projects\RBAC\data\Finance\quarterly_financial_report.md,finance,md,14,51,"finance,finance_lead,leadership,admin","duct development. - cash flow from financing: 25 million, supporting market expansion through additional financing.  risks  mitigation - risk: influencer marketing campaigns underperforming relative to expected roi. - mitigation: shifted to performance-based influencer contracts to align costs with measurable outcomes. - risk: intensified competition in southeast asia. - mitigation: enhanced marke"
CHUNK-000113,quarterly_financial_report.md,D:\Projects\RBAC\data\Finance\quarterly_financial_report.md,finance,md,15,59,"finance,finance_lead,leadership,admin","on in southeast asia. - mitigation: enhanced marketing strategies and forged strategic partnerships to strengthen market positioning. ---  q3 - july to september 2024  quarterly financial overview q3 2024 saw continued growth, with a focus on customer retention and latin american market expansion. key financial highlights include: - revenue: 2.4 billion, up 30 yoy, driven by strong performance in "
CHUNK-000114,quarterly_financial_report.md,D:\Projects\RBAC\data\Finance\quarterly_financial_report.md,finance,md,16,61,"finance,finance_lead,leadership,admin","llion, up 30 yoy, driven by strong performance in loyalty programs and new market penetration. - gross margin: 62, reflecting improved pricing strategies and cost efficiencies. - operating income: 600 million, supported by higher revenue and optimized operations. - net income: 300 million, up 15 yoy, bolstered by top-line growth and margin expansion. - marketing spend: 600 million, focused on cust"
CHUNK-000115,quarterly_financial_report.md,D:\Projects\RBAC\data\Finance\quarterly_financial_report.md,finance,md,17,55,"finance,finance_lead,leadership,admin","n. - marketing spend: 600 million, focused on customer retention initiatives and localized events in latin america. - vendor costs: 130 million, driven by local partnerships and loyalty program implementation.  quarterly expense breakdown expenses supported retention and expansion strategies: - vendor services: 130 million, with 35 (45.5 million) allocated to loyalty programs and customer retentio"
CHUNK-000116,quarterly_financial_report.md,D:\Projects\RBAC\data\Finance\quarterly_financial_report.md,finance,md,18,51,"finance,finance_lead,leadership,admin","llocated to loyalty programs and customer retention strategies. - employee benefits  hr: 50 million, reflecting increased recruitment and training costs to support growth. - software subscriptions: 50 million, maintaining investment in cloud-based infrastructure. - other operational expenses: 35 million, covering events, merchant partnerships, and regional activities.  cash flow analysis cash flow"
CHUNK-000117,quarterly_financial_report.md,D:\Projects\RBAC\data\Finance\quarterly_financial_report.md,finance,md,19,60,"finance,finance_lead,leadership,admin","regional activities.  cash flow analysis cash flow performance remained strong, enabling further investment: - cash flow from operations: 400 million, up 15 yoy, driven by robust revenue and improved collections. - cash flow from investing: 70 million, allocated to rd and latin american expansion efforts. - cash flow from financing: 30 million, focused on securing long-term capital for growth.  ri"
CHUNK-000118,quarterly_financial_report.md,D:\Projects\RBAC\data\Finance\quarterly_financial_report.md,finance,md,20,58,"finance,finance_lead,leadership,admin",used on securing long-term capital for growth.  risks  mitigation - risk: vendor cost inflation in latin america. - mitigation: renegotiated terms with local suppliers to secure favorable pricing and reduce costs. - risk: high days sales outstanding (dso) impacting cash flow. - mitigation: implemented improved invoicing and collection practices to accelerate receivables. ---  q4 - october to decem
CHUNK-000119,quarterly_financial_report.md,D:\Projects\RBAC\data\Finance\quarterly_financial_report.md,finance,md,21,56,"finance,finance_lead,leadership,admin","accelerate receivables. ---  q4 - october to december 2024  quarterly financial overview q4 2024 capped the year with exceptional performance, driven by end-of-year promotions and b2b marketing. key financial highlights include: - revenue: 2.6 billion, up 35 yoy, fueled by holiday campaigns and enterprise client acquisitions. - gross margin: 64, reflecting optimized pricing and operational efficie"
CHUNK-000120,quarterly_financial_report.md,D:\Projects\RBAC\data\Finance\quarterly_financial_report.md,finance,md,22,59,"finance,finance_lead,leadership,admin","flecting optimized pricing and operational efficiencies. - operating income: 650 million, supported by strong revenue and cost discipline. - net income: 325 million, up 18 yoy, driven by top-line growth and margin expansion. - marketing spend: 650 million, allocated to end-of-year promotions and b2b marketing campaigns. - vendor costs: 135 million, increased due to high sales volume during holiday"
CHUNK-000121,quarterly_financial_report.md,D:\Projects\RBAC\data\Finance\quarterly_financial_report.md,finance,md,23,54,"finance,finance_lead,leadership,admin"," increased due to high sales volume during holiday campaigns.  quarterly expense breakdown expenses were aligned with high-impact seasonal initiatives: - vendor services: 135 million, with 40 (54 million) allocated to end-of-year promotions and b2b marketing efforts. - employee benefits  hr: 55 million, driven by seasonal hiring and performance-based incentives. - software subscriptions: 55 millio"
CHUNK-000122,quarterly_financial_report.md,D:\Projects\RBAC\data\Finance\quarterly_financial_report.md,finance,md,24,55,"finance,finance_lead,leadership,admin","ed incentives. - software subscriptions: 55 million, consistent with prior quarters to support operational scalability. - other operational expenses: 40 million, covering final-quarter events and administrative costs.  cash flow analysis cash flow performance supported long-term growth: - cash flow from operations: 450 million, up 18 yoy, driven by strong holiday sales and efficient working capita"
CHUNK-000123,quarterly_financial_report.md,D:\Projects\RBAC\data\Finance\quarterly_financial_report.md,finance,md,25,56,"finance,finance_lead,leadership,admin"," strong holiday sales and efficient working capital management. - cash flow from investing: 80 million, allocated to product enhancements and global expansion. - cash flow from financing: 35 million, securing funds for sustained growth in 2025.  risks  mitigation - risk: increased vendor charges during the holiday season. - mitigation: streamlined procurement processes and negotiated fixed-cost ag"
CHUNK-000124,quarterly_financial_report.md,D:\Projects\RBAC\data\Finance\quarterly_financial_report.md,finance,md,26,56,"finance,finance_lead,leadership,admin","procurement processes and negotiated fixed-cost agreements to control expenses. - risk: revenue growth pressure in north america due to market saturation. - mitigation: launched aggressive digital marketing campaigns to capture additional market share. ---  2024 annual summary finsolve technologies inc. achieved remarkable financial results in 2024, with total revenue of 9.4 billion, a 28 yoy incr"
CHUNK-000125,quarterly_financial_report.md,D:\Projects\RBAC\data\Finance\quarterly_financial_report.md,finance,md,27,63,"finance,finance_lead,leadership,admin",", with total revenue of 9.4 billion, a 28 yoy increase. gross margin improved from 58 in q1 to 64 in q4, reflecting enhanced pricing strategies and operational efficiencies. net income grew to 1.15 billion, up 14 yoy, driven by consistent revenue growth and cost discipline. marketing spend totaled 2.3 billion, supporting global expansion and customer acquisition, while vendor costs rose modestly t"
CHUNK-000126,quarterly_financial_report.md,D:\Projects\RBAC\data\Finance\quarterly_financial_report.md,finance,md,28,59,"finance,finance_lead,leadership,admin","er acquisition, while vendor costs rose modestly to 510 million due to strategic investments in regional campaigns and loyalty programs. cash flow from operations reached 1.5 billion, up 14 yoy, enabling 260 million in investments for rd, market expansion, and product development. financing activities provided 110 million to support working capital and long-term growth. despite risks such as vendo"
CHUNK-000127,quarterly_financial_report.md,D:\Projects\RBAC\data\Finance\quarterly_financial_report.md,finance,md,29,53,"finance,finance_lead,leadership,admin"," and long-term growth. despite risks such as vendor cost inflation and competitive pressures, proactive mitigation strategies ensured financial stability and positioned finsolve technologies for continued success in 2025.  recommendations for 2025 1. optimize marketing roi: leverage data analytics to refine influencer and digital marketing strategies, ensuring higher returns on ad spend. 2. expand"
CHUNK-000128,quarterly_financial_report.md,D:\Projects\RBAC\data\Finance\quarterly_financial_report.md,finance,md,30,57,"finance,finance_lead,leadership,admin","es, ensuring higher returns on ad spend. 2. expand cost controls: continue vendor negotiations and explore automation to reduce operational and vendor costs. 3. accelerate global expansion: increase investment in high-growth regions like southeast asia and latin america to sustain revenue growth. 4. enhance cash flow management: further streamline accounts receivable processes to reduce dso and im"
CHUNK-000129,quarterly_financial_report.md,D:\Projects\RBAC\data\Finance\quarterly_financial_report.md,finance,md,31,51,"finance,finance_lead,leadership,admin","accounts receivable processes to reduce dso and improve liquidity.  conclusion finsolve technologies inc.s 2024 performance reflects our strategic focus on growth, efficiency, and customer-centric innovation. with record-breaking revenue, improved margins, and strong cash flow, we are well-positioned to capitalize on global opportunities in 2025. this report highlights our commitment to delivering"
CHUNK-000130,quarterly_financial_report.md,D:\Projects\RBAC\data\Finance\quarterly_financial_report.md,finance,md,32,18,"finance,finance_lead,leadership,admin",his report highlights our commitment to delivering value to stakeholders while navigating market challenges with agility and foresight.
CHUNK-000131,employee_handbook.md,D:\Projects\RBAC\data\general\employee_handbook.md,general,md,1,33,"all_employees,leadership,admin",employee handbook  table of contents 1. welcome  introduction(welcome--introduction) 2. employee onboarding  benefits(employee-onboarding--benefits) 3. leave policies(leave-policies) 4. work hours  attendance(work-hours--attendance) 5. code of conduct  workplace behavior(code-of-conduct--workplace-behavior) 6. health  safety(health--safety) 7. compensation  payroll(compensation--payroll) 8. reimbu
CHUNK-000132,employee_handbook.md,D:\Projects\RBAC\data\general\employee_handbook.md,general,md,2,33,"all_employees,leadership,admin","ensation  payroll(compensation--payroll) 8. reimbursement policies(reimbursement-policies) 9. training  development(training--development) 10. performance  feedback(performance--feedback) 11. privacy  data security(privacy--data-security) 12. exit policy(exit-policy) 13. faqs(faqs) 14. miscellaneous(miscellaneous) ---  welcome  introduction  company vision and mission at finsolve technologies, our"
CHUNK-000133,employee_handbook.md,D:\Projects\RBAC\data\general\employee_handbook.md,general,md,3,59,"all_employees,leadership,admin","y vision and mission at finsolve technologies, our vision is to empower businesses and individuals through innovative technology solutions. our mission is to deliver high-quality, sustainable products and services that create value for our stakeholders.  core values - integrity: we act with honesty and transparency. - respect: we value diversity and treat everyone with dignity. - innovation: we en"
CHUNK-000134,employee_handbook.md,D:\Projects\RBAC\data\general\employee_handbook.md,general,md,4,62,"all_employees,leadership,admin","d treat everyone with dignity. - innovation: we encourage creativity and continuous improvement. - customer focus: our customers are at the heart of everything we do. - accountability: we take responsibility for our actions and results.  company overview founded in 2016, finsolve technologies is a leading player in fintech with a presence across india and global markets. we are committed to ethica"
CHUNK-000135,employee_handbook.md,D:\Projects\RBAC\data\general\employee_handbook.md,general,md,5,57,"all_employees,leadership,admin","dia and global markets. we are committed to ethical business, social responsibility, and fostering a culture of learning and growth. ---  employee onboarding  benefits  onboarding process - pre-joining: offer letter issuance, document submission (id, address, education, previous employment). - day 1: welcome session, hr induction, it setup, introduction to team and mentor. - first week: policy ori"
CHUNK-000136,employee_handbook.md,D:\Projects\RBAC\data\general\employee_handbook.md,general,md,6,52,"all_employees,leadership,admin","ction to team and mentor. - first week: policy orientation, compliance training, role-specific training, buddy program. - first month: probation objectives set, regular check-ins with manager and hr.  employee benefits  statutory benefits  benefit  details  ------------------  employees provident fund (epf)  12 employer  employee contribution; as per epf act, 1952   employee state insurance (esi) "
CHUNK-000137,employee_handbook.md,D:\Projects\RBAC\data\general\employee_handbook.md,general,md,7,61,"all_employees,leadership,admin","er epf act, 1952   employee state insurance (esi)  for employees earning  21,000month; covers medical, disability, maternity   gratuity  payable after 5 years of continuous service; as per payment of gratuity act   maternity benefit  26 weeks paid leave for first two children; as per maternity benefit act   bonus  as per payment of bonus act; minimum 8.33 of basic salary   company benefits - group"
CHUNK-000138,employee_handbook.md,D:\Projects\RBAC\data\general\employee_handbook.md,general,md,8,55,"all_employees,leadership,admin","um 8.33 of basic salary   company benefits - group health insurance: family floater policy covering employee, spouse, and up to 2 children. - accident  life insurance: additional coverage for accidental death or disability. - wellness programs: annual health check-ups, yogameditation sessions, mental health counseling. - employee assistance program (eap): confidential counseling and support for pe"
CHUNK-000139,employee_handbook.md,D:\Projects\RBAC\data\general\employee_handbook.md,general,md,9,46,"all_employees,leadership,admin"," (eap): confidential counseling and support for personal or professional issues. - flexible work arrangements: remote work, flexible hours (role-dependent). ---  leave policies  types of leave  leave type  entitlementdetails  ---------------------------------  privilegeannual  15-21 daysyear (as per state shops  establishments act); accrued monthly   sick leave  12 daysyear (non-cumulative; medica"
